{
  "id": "cat_001",
  "name": "Tiere",
  "slug": "tiere",
  "description": "Willkommen im Tierlexikon! Hier kannst du Tiere aus aller Welt entdecken. Große Elefanten, winzige Käfer, bunte Vögel und flinke Fische warten auf dich. Du erfährst, wo sie leben, was sie mögen und wie sie sich bewegen. Jedes Tier ist einzigartig. Bist du bereit für eine bunte Reise durch die Tierwelt? Dann los, lass uns gemeinsam staunen!",
  "image": {
    "filename": "category-Tiere.png",
    "path": "images/category-Tiere.png",
    "alt": "Handgezeichnete Illustration verschiedener Tiere inklusive exotischer Tiere wie Löwen, Elefanten, Giraffen und heimischer Tiere in warmem Kinderbuch-Stil"
  },
  "audio": {
    "filename": "category-tiere.mp3",
    "path": "audio/category-tiere.mp3"
  },
  "character_emotions": ["excited", "curious", "surprised"],
  "safety_score": 8,
  "subcategories": [
    {
      "id": "subcat_001_001",
      "name": "Säugetiere",
      "slug": "saeugetiere",
      "description": "Säugetiere geben ihren Babys Milch und haben weiches Fell. Sie leben überall auf der Welt – im Wasser, auf dem Land und sogar in der Luft! Entdecke mit mir die spannende Welt der Säugetiere!",
      "image": { "filename": "category-Saeugetiere.png", "path": "images/category-Saeugetiere.png", "alt": "Handgezeichnete Illustration von verschiedenen Säugetieren in warmem Kinderbuch-Stil" },
      "audio": { "filename": "subcat-saeugetiere.mp3", "path": "audio/subcat-saeugetiere.mp3" },
      "character_emotions": ["curious", "excited", "thinking"],
      "safety_score": 9
    },
    {
      "id": "subcat_001_002",
      "name": "Vögel",
      "slug": "voegel",
      "description": "Vögel flattern durch die Lüfte, bauen Nester und legen Eier. Manche singen wunderschöne Lieder, andere fliegen um die halbe Welt! Lass uns die bunte Vogelwelt entdecken!",
      "image": { "filename": "category-Voegel.png", "path": "images/category-Voegel.png", "alt": "Handgezeichnete Illustration von verschiedenen Vögeln in warmem Kinderbuch-Stil" },
      "audio": { "filename": "subcat-voegel.mp3", "path": "audio/subcat-voegel.mp3" },
      "character_emotions": ["excited", "surprised", "curious"],
      "safety_score": 9
    },
    {
      "id": "subcat_001_003",
      "name": "Reptilien",
      "slug": "reptilien",
      "description": "Reptilien haben schuppige Haut und lieben es, sich in der Sonne zu wärmen. Sie kriechen, schwimmen oder klettern – und manche sehen aus wie kleine Drachen!",
      "image": { "filename": "category-Reptilien.png", "path": "images/category-Reptilien.png", "alt": "Handgezeichnete Illustration von verschiedenen Reptilien in warmem Kinderbuch-Stil" },
      "audio": { "filename": "subcat-reptilien.mp3", "path": "audio/subcat-reptilien.mp3" },
      "character_emotions": ["curious", "excited", "thinking"],
      "safety_score": 7
    },
    {
      "id": "subcat_001_004",
      "name": "Amphibien",
      "slug": "amphibien",
      "description": "Amphibien leben im Wasser und an Land. Frösche, Kröten und Salamander können oft super springen und lieben feuchte Plätze!",
      "image": { "filename": "category-Amphibien.png", "path": "images/category-Amphibien.png", "alt": "Handgezeichnete Illustration von Amphibien in warmem Kinderbuch-Stil" },
      "audio": { "filename": "subcat-amphibien.mp3", "path": "audio/subcat-amphibien.mp3" },
      "character_emotions": ["curious", "excited", "surprised"],
      "safety_score": 8
    },
    {
      "id": "subcat_001_005",
      "name": "Fische",
      "slug": "fische",
      "description": "Fische schwimmen flink durchs Wasser und atmen mit Kiemen. Es gibt sie in allen Farben und Formen – von winzig klein bis riesengroß!",
      "image": { "filename": "category-Fische.png", "path": "images/category-Fische.png", "alt": "Handgezeichnete Illustration von verschiedenen Fischen in warmem Kinderbuch-Stil" },
      "audio": { "filename": "subcat-fische.mp3", "path": "audio/subcat-fische.mp3" },
      "character_emotions": ["excited", "curious", "surprised"],
      "safety_score": 8
    },
    {
      "id": "subcat_001_006",
      "name": "Wirbellose Tiere",
      "slug": "wirbellose-tiere",
      "description": "Wirbellose Tiere haben kein Rückgrat. Dazu gehören Insekten, Spinnen, Schnecken und viele mehr. Sie sind oft winzig, aber super wichtig für die Natur!",
      "image": { "filename": "category-wirbellose-tiere.png", "path": "images/category-wirbellose-tiere.png", "alt": "Handgezeichnete Illustration von Wirbellosen Tieren in warmem Kinderbuch-Stil" },
      "audio": { "filename": "subcat-wirbellose-tiere.mp3", "path": "audio/subcat-wirbellose-tiere.mp3" },
      "character_emotions": ["curious", "excited", "surprised"],
      "safety_score": 9
    },
    {
      "id": "subcat_001_007",
      "name": "Haustiere und Nutztiere",
      "slug": "haustiere-nutztiere",
      "description": "Haustiere leben mit uns zusammen und sind unsere Freunde. Nutztiere helfen uns auf dem Bauernhof – sie geben Milch, Eier oder Wolle. Wer wohnt bei dir zu Hause oder auf dem Bauernhof?",
      "image": { "filename": "category-Haustiere.png", "path": "images/category-Haustiere.png", "alt": "Handgezeichnete Illustration von Haustieren in warmem Kinderbuch-Stil" },
      "audio": { "filename": "subcat-haustiere-nutztiere.mp3", "path": "audio/subcat-haustiere-nutztiere.mp3" },
      "character_emotions": ["excited", "curious", "laughing"],
      "safety_score": 9
    },
    {
      "id": "subcat_001_008",
      "name": "Waldtiere",
      "slug": "waldtiere",
      "description": "Im Wald leben viele spannende Tiere! Zwischen Bäumen, Moos und Büschen fühlen sie sich wohl. Wer versteckt sich wohl im grünen Dickicht?",
      "image": { "filename": "category-Waldtiere.png", "path": "images/category-Waldtiere.png", "alt": "Handgezeichnete Illustration vom Lebensraum Wald in warmem Kinderbuch-Stil" },
      "audio": { "filename": "subcat-waldtiere.mp3", "path": "audio/subcat-waldtiere.mp3" },
      "character_emotions": ["curious", "exploring", "excited"],
      "safety_score": 8
    },
    {
      "id": "subcat_001_009",
      "name": "Wiesentiere",
      "slug": "wiesentiere",
      "description": "Auf bunten Wiesen tummeln sich viele Tiere! Hier summen Bienen, flattern Schmetterlinge und grasen Hasen. Die Wiese ist ein Paradies für kleine und große Tiere!",
      "image": { "filename": "category-Wiesentiere.png", "path": "images/category-Wiesentiere.png", "alt": "Handgezeichnete Illustration von Wiesentieren in warmem Kinderbuch-Stil" },
      "audio": { "filename": "subcat-wiesentiere.mp3", "path": "audio/subcat-wiesentiere.mp3" },
      "character_emotions": ["curious", "excited", "exploring"],
      "safety_score": 9
    },
    {
      "id": "subcat_001_010",
      "name": "Gebirgstiere",
      "slug": "gebirgstiere",
      "description": "In den Bergen leben Tiere, die klettern und springen können. Steinböcke, Murmeltiere und Adler fühlen sich hier zu Hause – hoch oben zwischen Felsen und Schnee!",
      "image": { "filename": "category-Gebirgstiere.png", "path": "images/category-Gebirgstiere.png", "alt": "Handgezeichnete Illustration von Gebirgstieren in warmem Kinderbuch-Stil" },
      "audio": { "filename": "subcat-gebirgstiere.mp3", "path": "audio/subcat-gebirgstiere.mp3" },
      "character_emotions": ["curious", "excited", "exploring"],
      "safety_score": 9
    },
    {
      "id": "subcat_001_011",
      "name": "Steppentiere",
      "slug": "steppentiere",
      "description": "Die Steppe ist weit und trocken. Hier leben Tiere, die gut mit wenig Wasser auskommen – wie Antilopen, Strauße und Erdmännchen!",
      "image": { "filename": "category-Steppentiere.png", "path": "images/category-Steppentiere.png", "alt": "Handgezeichnete Illustration von Steppentieren in warmem Kinderbuch-Stil" },
      "audio": { "filename": "subcat-steppentiere.mp3", "path": "audio/subcat-steppentiere.mp3" },
      "character_emotions": ["curious", "excited", "exploring"],
      "safety_score": 8
    },
    {
      "id": "subcat_001_012",
      "name": "Meerestiere",
      "slug": "meerestiere",
      "description": "Das Meer ist voller Leben! Hier schwimmen Fische, Wale, Delfine und viele andere Tiere. Tauche mit uns ab in die Unterwasserwelt!",
      "image": { "filename": "category-Meerestiere.png", "path": "images/category-Meerestiere.png", "alt": "Handgezeichnete Illustration vom Lebensraum Meer in warmem Kinderbuch-Stil" },
      "audio": { "filename": "subcat-meerestiere.mp3", "path": "audio/subcat-meerestiere.mp3" },
      "character_emotions": ["excited", "surprised", "curious"],
      "safety_score": 8
    },
    {
      "id": "subcat_001_013",
      "name": "Süßwassertiere",
      "slug": "suesswassertiere",
      "description": "In Flüssen, Seen und Teichen leben viele spannende Tiere! Entdecke Fische, Frösche und Libellen in ihrem Süßwasser-Zuhause!",
      "image": { "filename": "category-suesswassertiere.png", "path": "images/category-suesswassertiere.png", "alt": "Handgezeichnete Illustration von Süßwassertieren in warmem Kinderbuch-Stil" },
      "audio": { "filename": "subcat-suesswassertiere.mp3", "path": "audio/subcat-suesswassertiere.mp3" },
      "character_emotions": ["curious", "excited", "exploring"],
      "safety_score": 8
    },
    {
      "id": "subcat_001_014",
      "name": "Wüstentiere",
      "slug": "wuestentiere",
      "description": "In der heißen Wüste leben Tiere, die mit wenig Wasser auskommen. Kamele, Skorpione und Wüstenfüchse sind echte Überlebenskünstler!",
      "image": { "filename": "category-Wuestentiere.png", "path": "images/category-Wuestentiere.png", "alt": "Handgezeichnete Illustration vom Lebensraum Wüste in warmem Kinderbuch-Stil" },
      "audio": { "filename": "subcat-wuestentiere.mp3", "path": "audio/subcat-wuestentiere.mp3" },
      "character_emotions": ["excited", "curious", "thinking"],
      "safety_score": 7
    },
    {
      "id": "subcat_001_015",